{
  "$schema": "https://msfsfailures.dev/schema/aircraft-pack.v1.json",
  "schemaVersion": 1,

  "pack": {
    "id": "com.msfsfailures.c172-default",
    "name": "Cessna 172 Skyhawk (default Asobo)",
    "author": "msfs-failures",
    "packVersion": "1.0.0",
    "match": {
      "title": ["Cessna Skyhawk G1000", "Cessna 172 Skyhawk"],
      "atcModel": ["C172"],
      "icaoType": ["C172"]
    },
    "tags": ["piston", "ga", "fixed-gear", "default-asobo", "lycoming-o320"]
  },

  "signals": [
    { "name": "engine_elapsed_s",     "source": "AVar", "expression": "GENERAL ENG ELAPSED TIME:1",        "unit": "seconds", "tier": "slow"  },
    { "name": "total_aircraft_hours", "source": "AVar", "expression": "TOTAL AIRCRAFT HOURS",              "unit": "hours",   "tier": "slow"  },

    { "name": "on_ground",            "source": "AVar", "expression": "SIM ON GROUND",                     "unit": "bool",    "tier": "fast"  },
    { "name": "g_force",              "source": "AVar", "expression": "G FORCE",                           "unit": "g",       "tier": "fast"  },
    { "name": "vertical_speed_fpm",   "source": "AVar", "expression": "VERTICAL SPEED",                    "unit": "fpm",     "tier": "fast"  },
    { "name": "touchdown_v_fpm",      "source": "AVar", "expression": "PLANE TOUCHDOWN NORMAL VELOCITY",   "unit": "fpm",     "tier": "event" },
    { "name": "ground_speed_kts",     "source": "AVar", "expression": "GROUND VELOCITY",                   "unit": "knots",   "tier": "fast"  },
    { "name": "airspeed_indicated",   "source": "AVar", "expression": "AIRSPEED INDICATED",                "unit": "knots",   "tier": "fast"  },
    { "name": "airspeed_true",        "source": "AVar", "expression": "AIRSPEED TRUE",                     "unit": "knots",   "tier": "slow"  },

    { "name": "engine_rpm",           "source": "AVar", "expression": "GENERAL ENG RPM:1",                 "unit": "rpm",     "tier": "fast"  },
    { "name": "manifold_pressure",    "source": "AVar", "expression": "GENERAL ENG MANIFOLD PRESSURE:1",   "unit": "inHg",    "tier": "slow"  },
    { "name": "throttle_pct",         "source": "AVar", "expression": "GENERAL ENG THROTTLE LEVER POSITION:1", "unit": "percent", "tier": "slow" },
    { "name": "mixture_pct",          "source": "AVar", "expression": "GENERAL ENG MIXTURE LEVER POSITION:1",  "unit": "percent", "tier": "slow" },
    { "name": "fuel_flow_gph",        "source": "AVar", "expression": "GENERAL ENG FUEL FLOW:1",           "unit": "gph",     "tier": "slow"  },
    { "name": "combustion",           "source": "AVar", "expression": "GENERAL ENG COMBUSTION:1",          "unit": "bool",    "tier": "event" },
    { "name": "starter",              "source": "AVar", "expression": "GENERAL ENG STARTER:1",             "unit": "bool",    "tier": "event" },

    { "name": "oil_temp_c",           "source": "AVar", "expression": "GENERAL ENG OIL TEMPERATURE:1",     "unit": "celsius", "tier": "slow"  },
    { "name": "oil_pressure_psi",     "source": "AVar", "expression": "GENERAL ENG OIL PRESSURE:1",        "unit": "psi",     "tier": "slow"  },
    { "name": "cht_c",                "source": "AVar", "expression": "RECIP ENG CYLINDER HEAD TEMPERATURE:1", "unit": "celsius", "tier": "slow", "fallback": null },
    { "name": "egt_c",                "source": "AVar", "expression": "GENERAL ENG EGT:1",                 "unit": "celsius", "tier": "slow", "fallback": null },

    { "name": "fuel_total_gal",       "source": "AVar", "expression": "FUEL TOTAL QUANTITY",               "unit": "gallons", "tier": "slow"  },
    { "name": "fuel_left_gal",        "source": "AVar", "expression": "FUEL LEFT QUANTITY",                "unit": "gallons", "tier": "slow"  },
    { "name": "fuel_right_gal",       "source": "AVar", "expression": "FUEL RIGHT QUANTITY",               "unit": "gallons", "tier": "slow"  },
    { "name": "fuel_selector",        "source": "AVar", "expression": "FUEL TANK SELECTOR:1",              "unit": "enum",    "tier": "event" },

    { "name": "battery_v",            "source": "AVar", "expression": "ELECTRICAL BATTERY VOLTAGE",        "unit": "volts",   "tier": "slow"  },
    { "name": "battery_load_a",       "source": "AVar", "expression": "ELECTRICAL BATTERY LOAD",           "unit": "amperes", "tier": "slow"  },
    { "name": "master_battery",       "source": "AVar", "expression": "ELECTRICAL MASTER BATTERY",         "unit": "bool",    "tier": "event" },
    { "name": "alternator_active",    "source": "AVar", "expression": "GENERAL ENG ALTERNATOR ACTIVE:1",   "unit": "bool",    "tier": "slow"  },
    { "name": "bus_v",                "source": "AVar", "expression": "BUS VOLTAGE:1",                     "unit": "volts",   "tier": "slow"  },

    { "name": "brake_left",           "source": "AVar", "expression": "BRAKE LEFT POSITION",               "unit": "percent", "tier": "fast"  },
    { "name": "brake_right",          "source": "AVar", "expression": "BRAKE RIGHT POSITION",              "unit": "percent", "tier": "fast"  },
    { "name": "parking_brake",        "source": "AVar", "expression": "BRAKE PARKING POSITION",            "unit": "bool",    "tier": "event" },
    { "name": "flaps_handle_pct",     "source": "AVar", "expression": "FLAPS HANDLE PERCENT",              "unit": "percent", "tier": "event" },

    { "name": "ambient_temp_c",       "source": "AVar", "expression": "AMBIENT TEMPERATURE",               "unit": "celsius", "tier": "slow"  },
    { "name": "ambient_pressure",     "source": "AVar", "expression": "AMBIENT PRESSURE",                  "unit": "inHg",    "tier": "slow"  },
    { "name": "pressure_alt",         "source": "AVar", "expression": "PRESSURE ALTITUDE",                 "unit": "feet",    "tier": "slow"  }
  ],

  "derived": [
    {
      "name": "power_pct",
      "recipe": "power_pct",
      "inputs": { "rpm": "engine_rpm", "manifoldPressure": "manifold_pressure", "redlineRpm": { "const": 2700 } }
    },
    {
      "name": "touchdown_energy_j",
      "recipe": "touchdown_energy",
      "inputs": { "verticalSpeed": "touchdown_v_fpm", "groundSpeed": "ground_speed_kts", "mass": { "const": 1157 } }
    },
    {
      "name": "shock_cooling_rate",
      "recipe": "shock_cooling_rate",
      "inputs": { "cht": "cht_c" }
    },
    {
      "name": "density_alt_ft",
      "recipe": "density_altitude",
      "inputs": { "pressureAlt": "pressure_alt", "oat": "ambient_temp_c" }
    },
    {
      "name": "braking_power",
      "recipe": "braking_energy",
      "inputs": { "brakeL": "brake_left", "brakeR": "brake_right", "groundSpeed": "ground_speed_kts" }
    },
    {
      "name": "start_kind",
      "recipe": "start_kind",
      "inputs": { "oilTemp": "oil_temp_c", "oat": "ambient_temp_c" }
    },
    {
      "name": "battery_discharge_edge",
      "recipe": "discharge_cycle",
      "inputs": { "batteryV": "battery_v", "alternatorActive": "alternator_active" }
    }
  ],

  "components": [
    {
      "id": "engine_1",
      "category": "Engine",
      "name": "Lycoming O-320-H2AD",
      "mtbfHours": 2000,
      "replaceIntervalHours": 2000,
      "wearCurve": { "type": "weibull", "shape": 2.4, "scale": 2200 },
      "stress": {
        "highPower":     { "signal": "power_pct",         "above": 0.75, "factor": 1.6 },
        "chtHot":        { "signal": "cht_c",             "above": 232,  "factor": 3.0 },
        "shockCooling":  { "signal": "shock_cooling_rate","above": 28,   "factor": 2.5 },
        "oilHot":        { "signal": "oil_temp_c",        "above": 118,  "factor": 2.0 },
        "oilCold":       { "signal": "oil_temp_c",        "below": 24,   "factor": 1.5 },
        "highDA":        { "signal": "density_alt_ft",    "above": 8000, "factor": 1.2 },
        "hotStart":      { "event":  "start_kind",        "equals": "hot", "addCycles": 1 }
      },
      "failureModes": ["mag_drop_left", "mag_drop_right", "low_oil_pressure", "rough_running", "carb_ice"],
      "consumables": ["oil_engine_1"],
      "requires": ["engine_rpm", "manifold_pressure", "oil_temp_c", "oil_pressure_psi"],
      "optional": ["cht_c", "egt_c"]
    },
    {
      "id": "starter_1",
      "category": "Engine",
      "name": "Starter motor",
      "mtbfHours": 1500,
      "wearCurve": { "type": "linear", "rate": 0.0007 },
      "stress": {
        "longCrank":  { "signal": "starter", "above": 0.5, "factor": 4.0 },
        "lowVoltage": { "signal": "battery_v", "below": 10.5, "factor": 2.5 }
      },
      "failureModes": ["starter_slow", "starter_no_crank"],
      "requires": ["starter", "battery_v"]
    },
    {
      "id": "battery_main",
      "category": "Battery",
      "name": "Main battery (12V lead-acid)",
      "mtbfHours": 1200,
      "replaceIntervalCycles": 800,
      "wearCurve": { "type": "exponential", "rate": 0.0009 },
      "stress": {
        "deepDischarge":   { "signal": "battery_v",      "below": 11.0, "factor": 4.0 },
        "altOff":          { "signal": "alternator_active", "equals": false, "factor": 1.5 },
        "dischargeCycle":  { "event":  "battery_discharge_edge", "equals": true, "addCycles": 1 }
      },
      "consumables": ["battery_soh_main"],
      "failureModes": ["battery_low_capacity", "battery_dead_cell"],
      "requires": ["battery_v", "master_battery", "alternator_active"]
    },
    {
      "id": "alternator_1",
      "category": "Battery",
      "name": "60A alternator",
      "mtbfHours": 1800,
      "wearCurve": { "type": "linear", "rate": 0.00055 },
      "failureModes": ["alternator_fail", "alternator_low_output"],
      "requires": ["alternator_active", "bus_v"]
    },
    {
      "id": "gear_main_left",
      "category": "GearBrakes",
      "name": "Left main gear",
      "mtbfHours": 5000,
      "wearCurve": { "type": "weibull", "shape": 1.8, "scale": 5500 },
      "stress": {
        "hardLanding": { "signal": "touchdown_energy_j", "above": 35000, "factor": 6.0 }
      },
      "failureModes": ["oleo_leak", "strut_bottomed"],